<?xml version="1.0" encoding="UTF-8"?>
<tns:conferences xmlns:tns="http://www.example.org/student" xmlns:xsi="http://www.w3.org/2001/XMLSchema-instance" xsi:schemaLocation="http://www.example.org/student conference.xsd ">
  <tns:conference>
    <tns:name>tns:name</tns:name>
    <tns:year>0</tns:year>
    <tns:chair>tns:chair</tns:chair>
    <tns:topic>tns:topic</tns:topic>
    <tns:city>tns:city</tns:city>
    <tns:country>tns:country</tns:country>
    <tns:hotelchainname>tns:hotelchainname</tns:hotelchainname>
    <tns:hotelbranchname>tns:hotelbranchname</tns:hotelbranchname>
  </tns:conference>
</tns:conferences>
